,bu_links,c_address,c_name,c_product,co_links,category,hangye,quxian,ximu
0,https://www.atobo.com.cn/GongShang/067/ED1F20C4B10E4F148CC9B1E5A1620B3C.html,地址：上海宝山区沪太路9711号,上海地凯贸易有限公司,主营：塑料包装制品的生产和销售,https://zcxisu426.atobo.com.cn,上海市宝山塑料制品,化工,宝山,塑料制品
1,https://www.atobo.com.cn/GongShang/406/DBDEA521FD2E49A2AD0CE949A2246D13.html,地址：上海市宝山区美秀路358弄,陕西保亿达新材料有限公司,主营：PSP钢塑复合压力管，钢骨架聚乙烯复合管，钢丝网骨架塑料复合管,https://zy159357.atobo.com.cn,上海市宝山塑料制品,化工,宝山,塑料制品
2,https://www.atobo.com.cn/GongShang/883/4A6EDCA0EC0946578DB4D2A757DB2117.html,地址：上海市宝山区祁骆路18号A-5,上海依云商务用品实业有限公司依勤分公司,主营：,https://ktfh67809.atobo.com.cn,上海市宝山塑料制品,化工,宝山,塑料制品
0,https://www.atobo.com.cn/GongShang/319/002099AA5432461DBF55097DF70F945B.html,地址：上海市宝山区金石路1688号D-073,上海彼祥机械设备有限公司,主营：,https://vemx887079.atobo.com.cn,上海市宝山塑料制品,化工,宝山,塑料制品
1,https://www.atobo.com.cn/GongShang/307/57A2C46044E14142A771949DEEE1D4D9.html,地址：上海市宝山区宝杨路1800号2号楼2932室,上海子成精密机械有限公司,主营：,https://iktg1015049.atobo.com.cn,上海市宝山塑料制品,化工,宝山,塑料制品
2,https://www.atobo.com.cn/GongShang/422/6C06344BF4754CEB969D776DA41137C1.html,地址：上海市宝山区月罗路2106号,上海含山瓷业有限公司罗店分公司,主营：,https://phwq967307.atobo.com.cn,上海市宝山塑料制品,化工,宝山,塑料制品
